{
  "schema_version": 2,
  "analysis_version": "simulate-analysis/v2",
  "spec_sha256": "ec08dbd491889690596c6f5219200dc5bce8c087e3b576467eb08c890eaef7a3",
  "analysis_sha256": "865a40e535b8dfae0ca4078765be2c80f0479070199b8f21c8a78b81c1256af7",
  "mode": "standard",
  "focus": null,
  "scenario_cap": 12,
  "iteration": 0,
  "status": "active",
  "stop_reason": null,
  "next_counter": 1,
  "pending": [
    {
      "id": "A01",
      "slug": "concurrent-payment",
      "category": "attack",
      "title": "Concurrent payment",
      "brief": "Two payment attempts race the single transition.",
      "priority": 1,
      "actors_involved": ["SERVICE", "STORE"],
      "transitions_targeted": ["T01"],
      "invariants_targeted": ["I01"],
      "attempts": 0,
      "last_error": null,
      "artifact_path": null,
      "artifact_sha256": null
    },
    {
      "id": "A02",
      "slug": "replayed-payment",
      "category": "attack",
      "title": "Replayed payment",
      "brief": "A completed payment request is replayed.",
      "priority": 1,
      "actors_involved": ["SERVICE", "STORE"],
      "transitions_targeted": ["T01"],
      "invariants_targeted": ["I01"],
      "attempts": 0,
      "last_error": null,
      "artifact_path": null,
      "artifact_sha256": null
    },
    {
      "id": "E01",
      "slug": "missing-order",
      "category": "edge",
      "title": "Missing order",
      "brief": "Payment targets an order that does not exist.",
      "priority": 2,
      "actors_involved": ["SERVICE", "STORE"],
      "transitions_targeted": ["T01"],
      "invariants_targeted": ["I01"],
      "attempts": 0,
      "last_error": null,
      "artifact_path": null,
      "artifact_sha256": null
    },
    {
      "id": "E02",
      "slug": "already-paid-order",
      "category": "edge",
      "title": "Already paid order",
      "brief": "Payment targets an order already in the paid state.",
      "priority": 2,
      "actors_involved": ["SERVICE", "STORE"],
      "transitions_targeted": ["T01"],
      "invariants_targeted": ["I01"],
      "attempts": 0,
      "last_error": null,
      "artifact_path": null,
      "artifact_sha256": null
    },
    {
      "id": "G01",
      "slug": "single-payment",
      "category": "golden",
      "title": "Single payment",
      "brief": "One payment moves a pending order to paid.",
      "priority": 2,
      "actors_involved": ["SERVICE", "STORE"],
      "transitions_targeted": ["T01"],
      "invariants_targeted": ["I01"],
      "attempts": 0,
      "last_error": null,
      "artifact_path": null,
      "artifact_sha256": null
    },
    {
      "id": "E03",
      "slug": "empty-payment-input",
      "category": "edge",
      "title": "Empty payment input",
      "brief": "The payment request omits its order reference.",
      "priority": 3,
      "actors_involved": ["SERVICE", "STORE"],
      "transitions_targeted": ["T01"],
      "invariants_targeted": ["I01"],
      "attempts": 0,
      "last_error": null,
      "artifact_path": null,
      "artifact_sha256": null
    },
    {
      "id": "G02",
      "slug": "payment-readback",
      "category": "golden",
      "title": "Payment readback",
      "brief": "The paid state is visible after the transition.",
      "priority": 3,
      "actors_involved": ["SERVICE", "STORE"],
      "transitions_targeted": ["T01"],
      "invariants_targeted": ["I01"],
      "attempts": 0,
      "last_error": null,
      "artifact_path": null,
      "artifact_sha256": null
    },
    {
      "id": "G03",
      "slug": "sequential-payments",
      "category": "golden",
      "title": "Sequential independent payments",
      "brief": "Two independent orders each complete once.",
      "priority": 3,
      "actors_involved": ["SERVICE", "STORE"],
      "transitions_targeted": ["T01"],
      "invariants_targeted": ["I01"],
      "attempts": 0,
      "last_error": null,
      "artifact_path": null,
      "artifact_sha256": null
    }
  ],
  "in_progress": [],
  "done": [],
  "failed": []
}
